<?xml version="1.0"?>
<!DOCTYPE ECConfiguration SYSTEM "ecconfig.dtd">

<ECConfiguration>
    
<!-- Define the events -->
<Event name="Subtask2 Trigger" type="17">
  <Period>200</Period> <!-- in msec -->
  <Phase>0</Phase> <!-- in msec -->
  <Criticality value="VERY_LOW" />
  <Importance value="VERY_LOW" />
  <WorstExecution>50</WorstExecution> <!-- in msec -->
  <TypicalExecution>50</TypicalExecution> <!-- in msec -->
</Event>

<Event name="Subtask3 Trigger" type="18">
  <Period>200</Period> <!-- in msec -->
  <Phase>0</Phase> <!-- in msec -->
  <Criticality value="VERY_HIGH" />
  <Importance value="VERY_HIGH" />
  <WorstExecution>50</WorstExecution> <!-- in msec -->
  <TypicalExecution>50</TypicalExecution> <!-- in msec -->
</Event>

<!-- Configure the ECs -->
<RemoteEventChannel name="Client" connection="Output">
  <IORFile>Client.ior</IORFile>
</RemoteEventChannel>
<RemoteEventChannel name="Server" connection="Input">
  <IORFile>Server.ior</IORFile>
</RemoteEventChannel>

<LocalEventChannel name="Middle" >
  <SchedulingStrategy type="EDF" enableRG="true" />
  <Supplier name="Subtask3 Notifier" id="3">
    <Publications>
      <EventName>Subtask3 Trigger</EventName>
    </Publications>
  </Supplier>
  <Consumer name="Subtask2 Executor" >
    <Subscriptions>
      <EventName>Subtask2 Trigger</EventName>
    </Subscriptions>
    <Dependants>
      <SupplierName>Subtask3 Notifier</SupplierName>
    </Dependants>
  </Consumer>
</LocalEventChannel>

<!-- Configure the driver -->
<TestDriver>
  <StartCondition type="DelayAfterConnect" >
    <Time>10000</Time> <!-- in msecs -->
  </StartCondition>
  <StopCondition type="Duration" >
    <Value>340000</Value> <!-- duration in msecs -->
  </StopCondition>
</TestDriver>

</ECConfiguration>